{
  "aliases": [
    {
      "$schema": "https://llm-catalog.example.cn/schemas/alias.schema.json",
      "alias_set_id": "current-project",
      "entries": [
        {
          "alias": "gpt-5.5",
          "provider_id": "openai",
          "target_id": "openai/gpt-5.5",
          "target_type": "offering"
        },
        {
          "alias": "gpt-5.5-2026-04-23",
          "provider_id": "openai",
          "target_id": "openai/gpt-5.5",
          "target_type": "offering"
        },
        {
          "alias": "glm-5.2",
          "provider_id": "zhipu",
          "target_id": "zhipu/glm-5.2",
          "target_type": "offering"
        },
        {
          "alias": "glm-4.6v",
          "provider_id": "zhipu",
          "target_id": "zhipu/glm-4.6v",
          "target_type": "offering"
        },
        {
          "alias": "embedding-3",
          "provider_id": "zhipu",
          "target_id": "zhipu/embedding-3",
          "target_type": "offering"
        }
      ],
      "evidence": [
        {
          "confidence": "high",
          "notes": "智谱标识由各模型官方页复核；OpenAI 标识由 GPT-5.5 官方模型页复核。",
          "redistribution": "unknown",
          "retrieved_at": "2026-08-02T00:00:00Z",
          "source_id": "official-model-identifiers",
          "source_type": "official_docs",
          "source_url": "https://docs.bigmodel.cn/cn/guide/start/model-overview",
          "verified_at": "2026-08-02T00:00:00Z"
        },
        {
          "confidence": "high",
          "notes": "这些标识覆盖当前 FDE 配置/契约测试中的聊天、推理、多模态和 Embedding 模型。",
          "redistribution": "restricted",
          "retrieved_at": "2026-08-02T00:00:00Z",
          "source_id": "project-fde-head",
          "source_type": "project_audit",
          "source_url": "urn:git:fses-design-mono:c88e5def41856e42449d52ed6d1b05e6fab09d12",
          "verified_at": "2026-08-02T00:00:00Z"
        }
      ],
      "field_annotations": {
        "/alias_set_id": {
          "adapter_mapping": null,
          "metadata_only": true,
          "runtime_effective": false,
          "source_ids": [
            "project-fde-head"
          ],
          "unsupported_reason": null
        },
        "/entries": {
          "adapter_mapping": "catalog alias resolver before adapter construction",
          "metadata_only": false,
          "runtime_effective": false,
          "source_ids": [
            "official-model-identifiers",
            "project-fde-head"
          ],
          "unsupported_reason": "当前三个项目尚未接入 canonical/offering alias 解析；私有标识必须用租户 override 显式映射。"
        }
      },
      "schema_version": "2.0.0"
    }
  ],
  "catalog_version": "2026.08.1",
  "generated_at": "2026-08-02T04:59:03Z",
  "models": [
    {
      "$schema": "https://llm-catalog.example.cn/schemas/canonical-model.schema.json",
      "aliases": [
        "gpt-5.5-2026-04-23"
      ],
      "canonical_id": "openai/gpt-5.5",
      "capabilities": {
        "agent": {
          "json_schema": true,
          "parallel_tool_calls": "unknown",
          "stream_usage": "unknown",
          "streaming": true,
          "strict_tools": "unknown",
          "structured_output": true,
          "system_message": "unknown",
          "tool_call": true,
          "tool_choice": "unknown"
        },
        "reasoning": {
          "budget_tokens": "unknown",
          "effort_values": [
            "none",
            "low",
            "medium",
            "high",
            "xhigh"
          ],
          "interleaved_reasoning": "unknown",
          "modes": [
            "effort"
          ],
          "protocol_fields": {
            "openai_chat_completions": "reasoning_effort",
            "openai_responses": "reasoning.effort"
          },
          "supported": true
        }
      },
      "embedding": null,
      "evidence": [
        {
          "confidence": "high",
          "notes": "仅摘录模型标识、快照、限额、模态、端点和明确列出的能力事实；未镜像文档正文。",
          "redistribution": "unknown",
          "retrieved_at": "2026-08-02T00:00:00Z",
          "source_id": "openai-gpt-5.5-model",
          "source_type": "official_docs",
          "source_url": "https://developers.openai.com/api/docs/models/gpt-5.5",
          "verified_at": "2026-08-02T00:00:00Z"
        },
        {
          "confidence": "high",
          "notes": "用于核验 reasoning effort 选项及结构化输出、工具工作流说明。",
          "redistribution": "unknown",
          "retrieved_at": "2026-08-02T00:00:00Z",
          "source_id": "openai-gpt-5.5-guidance",
          "source_type": "official_docs",
          "source_url": "https://developers.openai.com/api/docs/guides/latest-model?model=gpt-5.5",
          "verified_at": "2026-08-02T00:00:00Z"
        },
        {
          "confidence": "high",
          "notes": "仅记录当前项目出现该 API 模型标识及运行时映射审计结论，不复制私有仓库内容。",
          "redistribution": "restricted",
          "retrieved_at": "2026-08-02T00:00:00Z",
          "source_id": "project-fde-head",
          "source_type": "project_audit",
          "source_url": "urn:git:fses-design-mono:c88e5def41856e42449d52ed6d1b05e6fab09d12",
          "verified_at": "2026-08-02T00:00:00Z"
        }
      ],
      "family": "GPT-5",
      "field_annotations": {
        "/aliases": {
          "adapter_mapping": null,
          "metadata_only": true,
          "runtime_effective": false,
          "source_ids": [
            "openai-gpt-5.5-model"
          ],
          "unsupported_reason": null
        },
        "/canonical_id": {
          "adapter_mapping": null,
          "metadata_only": true,
          "runtime_effective": false,
          "source_ids": [
            "openai-gpt-5.5-model",
            "project-fde-head"
          ],
          "unsupported_reason": null
        },
        "/capabilities/agent/*": {
          "adapter_mapping": "capability-aware ChatOpenAI/DeepAgent adapter",
          "metadata_only": false,
          "runtime_effective": false,
          "source_ids": [
            "openai-gpt-5.5-model",
            "project-fde-head"
          ],
          "unsupported_reason": "当前 FDE 未消费细粒度 Agent 能力，streaming 仍为硬编码。"
        },
        "/capabilities/agent/tool_call": {
          "adapter_mapping": "current coarse functionCallSupport admission gate",
          "metadata_only": false,
          "runtime_effective": true,
          "source_ids": [
            "openai-gpt-5.5-model",
            "project-fde-head"
          ],
          "unsupported_reason": "当前仅映射为粗粒度枚举，不能代表 tool_choice、parallel 或 strict。"
        },
        "/capabilities/reasoning/*": {
          "adapter_mapping": "ChatOpenAI.reasoning / protocol request fields",
          "metadata_only": false,
          "runtime_effective": false,
          "source_ids": [
            "openai-gpt-5.5-guidance",
            "project-fde-head"
          ],
          "unsupported_reason": "当前 FDE 仅记录 isReasonModel，未构造 reasoning 参数。"
        },
        "/capabilities/reasoning/supported": {
          "adapter_mapping": null,
          "metadata_only": true,
          "runtime_effective": false,
          "source_ids": [
            "openai-gpt-5.5-model",
            "project-fde-head"
          ],
          "unsupported_reason": null
        },
        "/embedding": {
          "adapter_mapping": null,
          "metadata_only": true,
          "runtime_effective": false,
          "source_ids": [
            "openai-gpt-5.5-model"
          ],
          "unsupported_reason": null
        },
        "/family": {
          "adapter_mapping": null,
          "metadata_only": true,
          "runtime_effective": false,
          "source_ids": [
            "openai-gpt-5.5-model"
          ],
          "unsupported_reason": null
        },
        "/kind": {
          "adapter_mapping": "FDE modelType role-admission gate",
          "metadata_only": false,
          "runtime_effective": true,
          "source_ids": [
            "openai-gpt-5.5-model",
            "project-fde-head"
          ],
          "unsupported_reason": null
        },
        "/lifecycle/*": {
          "adapter_mapping": null,
          "metadata_only": true,
          "runtime_effective": false,
          "source_ids": [
            "openai-gpt-5.5-model"
          ],
          "unsupported_reason": null
        },
        "/limits/max_context_tokens": {
          "adapter_mapping": "current FDE model.profile.maxInputTokens (semantic mismatch; must be replaced)",
          "metadata_only": false,
          "runtime_effective": true,
          "source_ids": [
            "openai-gpt-5.5-model",
            "project-fde-head"
          ],
          "unsupported_reason": "当前实现错误地把 context 上限当作 input 上限，后续集成不得沿用。"
        },
        "/limits/max_input_tokens": {
          "adapter_mapping": "DeepAgent model.profile.maxInputTokens",
          "metadata_only": false,
          "runtime_effective": false,
          "source_ids": [
            "openai-gpt-5.5-model",
            "project-fde-head"
          ],
          "unsupported_reason": "当前数据库与 FDE 契约缺少独立 max_input_tokens；unknown 时必须 fail closed 或由租户显式 override。"
        },
        "/limits/max_output_tokens": {
          "adapter_mapping": "ChatOpenAI.maxTokens / ChatAnthropic.maxTokens",
          "metadata_only": false,
          "runtime_effective": true,
          "source_ids": [
            "openai-gpt-5.5-model",
            "project-fde-head"
          ],
          "unsupported_reason": null
        },
        "/manufacturer_id": {
          "adapter_mapping": null,
          "metadata_only": true,
          "runtime_effective": false,
          "source_ids": [
            "openai-gpt-5.5-model"
          ],
          "unsupported_reason": null
        },
        "/modalities/*": {
          "adapter_mapping": "FDE role-admission and content-part validation",
          "metadata_only": false,
          "runtime_effective": false,
          "source_ids": [
            "openai-gpt-5.5-model",
            "project-fde-head"
          ],